milk,0,a white nutritious liquid secreted by mammals and used as food by human beings,produced by mammary glands of female mammals for feeding their young,a river that rises in the Rockies in northwestern Montana and flows eastward to become a tributary of the Missouri River (not an entity),any of several nutritive milklike liquids,,,,,,,,,,,,,,
grime,0,the state of being covered with unclean things,,,,,,,,,,,,,,,,,
copper,0,a ductile malleable reddish-brown corrosion-resistant diamagnetic metallic element; occurs in various minerals but is the only metal that occurs abundantly in large masses; used as an electrical and thermal conductor,a copper penny,uncomplimentary terms for a policeman,a reddish-brown color resembling the color of polished copper,any of various small butterflies of the family Lycaenidae having coppery wings,,,,,,,,,,,,,
brick,0,rectangular block of clay baked by the sun or in a kiln; used as a building or paving material,a good fellow; helpful and trustworthy,,,,,,,,,,,,,,,,
tripoli,0,a weathered and decomposed siliceous limestone; in powdered form it is used in polishing,the capital and chief port and largest city of Libya; in northwestern Libya on the Mediterranean Sea; founded by the Phoenicians in the 7th century BC (not an entity),a port city and commercial center in northwestern Lebanon on the Mediterranean Sea (not an entity),,,,,,,,,,,,,,,
solfo,0,,,,,,,,,,,,,,,,,,
trwood,0,,,,,,,,,,,,,,,,,,
antimony,0,a metallic element having four allotropic forms; used in a wide variety of alloys; found in stibnite,,,,,,,,,,,,,,,,,
galipot,0,,,,,,,,,,,,,,,,,,
cocon.,0,,,,,,,,,,,,,,,,,,
amethyst,0,a transparent purple variety of quartz; used as a gemstone,,,,,,,,,,,,,,,,,
lampblack,0,a black colloidal substance consisting wholly or principally of amorphous carbon and used to make pigments and ink,,,,,,,,,,,,,,,,,
rosemary,0,widely cultivated for its fragrant grey-green leaves used in cooking and in perfumery,extremely pungent leaves used fresh or dried as seasoning for especially meats,,,,,,,,,,,,,,,,
sugar,0,a white crystalline carbohydrate used as a sweetener and preservative,an essential structural component of living cells and source of energy for animals; includes simple sugars with small molecules as well as macromolecular substances; are classified according to the number of monosaccharide groups they contain,informal terms for money,,,,,,,,,,,,,,,
benzoin,0,gum resin used especially in treating skin irritation,used in some classifications for the American spicebush and certain other plants often included in the genus Lindera,,,,,,,,,,,,,,,,
quarton,0,,,,,,,,,,,,,,,,,,
billon,0,,,,,,,,,,,,,,,,,,
starch,0,"a complex carbohydrate found chiefly in seeds, fruits, tubers, roots and stem pith of plants, notably in corn, potatoes, wheat, and rice; an important foodstuff and used otherwise especially in adhesives and as fillers and stiffeners for paper and textiles",a commercial preparation of starch that is used to stiffen textile fabrics in laundering,,,,,,,,,,,,,,,,
rapeseed,0,seed of rape plants; source of an edible oil,,,,,,,,,,,,,,,,,
gold,2,coins made of gold,a deep yellow color,a soft yellow malleable ductile (trivalent and univalent) metallic element; occurs mainly as nuggets in rocks and alluvial deposits; does not react with most chemicals but is attacked by chlorine and aqua regia,great wealth; --Ben Jonson,something likened to the metal in brightness or preciousness or superiority etc.,,,,,,,,,,,,,
aloe,0,succulent plants having rosettes of leaves usually with fiber like hemp and spikes of showy flowers; found chiefly in Africa,,,,,,,,,,,,,,,,,
gilding,0,a coating of gold or of something that looks like gold,,,,,,,,,,,,,,,,,
cornaline,0,,,,,,,,,,,,,,,,,,
"rowan,",0,,,,,,,,,,,,,,,,,,
rooftile,0,,,,,,,,,,,,,,,,,,
musk,0,an odorous glandular secretion from the male musk deer; used as a perfume fixative,the scent of a greasy glandular secretion from the male musk deer,,,,,,,,,,,,,,,,
dittany,0,Eurasian perennial herb with white flowers that emit flammable vapor in hot weather,,,,,,,,,,,,,,,,,
spalt,0,,,,,,,,,,,,,,,,,,
