cast,0,the actors in a play,container into which liquid is poured to create a given shape when it hardens,the distinctive form in which a thing is made,the visual appearance of something or someone,bandage consisting of a firm covering (often made of plaster of Paris) that immobilizes broken bones while they heal,object formed by a mold,the act of throwing dice,the act of throwing a fishing line out over the water by means of a rod and reel,a violent throw,,,,,,,,,,,,,,,,,
trusseaulx,0,,,,,,,,,,,,,,,,,,,,,,,,,,
chafing-dish,0,,,,,,,,,,,,,,,,,,,,,,,,,,
furnace,0,"an enclosed chamber in which heat is produced to heat buildings, destroy refuse, smelt or refine ores, etc.",,,,,,,,,,,,,,,,,,,,,,,,,
contour,0,a line drawn on a map connecting points of equal height,any spatial attributes (especially as defined by outline),a feature (or the order or arrangement of features) of anything having a complex structure,,,,,,,,,,,,,,,,,,,,,,,
fire-steel,0,,,,,,,,,,,,,,,,,,,,,,,,,,
matrass,0,,,,,,,,,,,,,,,,,,,,,,,,,,
tin,0,a silvery malleable metallic element that resists corrosion; used in many alloys and to coat other metals to prevent corrosion; obtained chiefly from cassiterite where it occurs as tin oxide,"a vessel (box, can, pan, etc.) made of tinplate and used mainly in baking",metal container for storing dry foods such as tea or flour,airtight sealed metal container for food or drink or paint etc.,,,,,,,,,,,,,,,,,,,,,,
leather,0,an animal skin made smooth and flexible by removing the hair and then tanning,,,,,,,,,,,,,,,,,,,,,,,,,
ditto,0,a mark used to indicate the word above it should be repeated,,,,,,,,,,,,,,,,,,,,,,,,,
burin,0,a chisel of tempered steel with a sharp point; used for engraving,,,,,,,,,,,,,,,,,,,,,,,,,
blast-pipe,0,,,,,,,,,,,,,,,,,,,,,,,,,,
cane,0,a stick that people can lean on to help them walk,"a strong slender often flexible stem as of bamboos, reeds, rattans, or sugar cane",a stiff switch used to hit students as punishment,,,,,,,,,,,,,,,,,,,,,,,
linen,0,a fabric woven with fibers from the flax plant,a high-quality paper made of linen fibers or with a linen finish,white goods or clothing made with linen cloth,,,,,,,,,,,,,,,,,,,,,,,
candlelight,0,the light provided by a burning candle,,,,,,,,,,,,,,,,,,,,,,,,,
desramonet,0,,,,,,,,,,,,,,,,,,,,,,,,,,
mallet,0,a sports implement with a long handle and a head like a hammer; used in sports (polo or croquet) to hit a ball,"a light drumstick with a rounded head that is used to strike such percussion instruments as chimes, kettledrums, marimbas, glockenspiels, etc.",a tool resembling a hammer but with a large head (usually wooden); used to drive wedges or ram down paving stones or for crushing or beating or flattening or smoothing,,,,,,,,,,,,,,,,,,,,,,,
quill,0,pen made from a bird's feather,a stiff hollow protective spine on a porcupine or hedgehog,any of the larger wing or tail feathers of a bird,the hollow spine of a feather,,,,,,,,,,,,,,,,,,,,,,
crucible,0,a vessel made of material that does not melt easily; used for high temperature chemical reactions,,,,,,,,,,,,,,,,,,,,,,,,,
cutting-punch,0,,,,,,,,,,,,,,,,,,,,,,,,,,
syringe,0,a medical instrument used to inject or withdraw fluids,,,,,,,,,,,,,,,,,,,,,,,,,
well-forged,0,,,,,,,,,,,,,,,,,,,,,,,,,,
frame,0,the framework for a pair of eyeglasses,"a single one of a series of still transparent pictures forming a cinema, television or video film",alternative names for the body of a human being,(baseball) one of nine divisions of play during which each team has a turn at bat,a single drawing in a comic_strip,an application that divides the user's display into two or more windows that can be scrolled independently,a system of assumptions and standards that sanction behavior and give it meaning,the hard structure (bones and cartilages) that provides a frame for the body of an animal,the internal supporting structure that gives an artifact its shape,a framework that supports and protects a picture or a mirror,one of the ten divisions into which bowling is divided,,,,,,,,,,,,,,,
glass,0,a brittle transparent solid with irregular atomic structure,a container for holding liquids while drinking,the quantity a glass will hold,a small refracting telescope,an amphetamine derivative (trade name Methedrine) used in the form of a crystalline hydrochloride; used as a stimulant to the nervous system and as an appetite suppressant,a mirror; usually a ladies' dressing mirror,glassware collectively,,,,,,,,,,,,,,,,,,,
pipe,0,a tube with a small bowl at one end; used for smoking tobacco,a long tube made of metal or plastic that is used to carry water or oil or gas etc.,a hollow cylindrical shape,a tubular wind instrument,the flues and stops on a pipe organ,,,,,,,,,,,,,,,,,,,,,
marble,0,a hard crystalline metamorphic rock that takes a high polish; used for sculpture and as building material,a small ball of glass that is used in various games,a sculpture carved from marble,,,,,,,,,,,,,,,,,,,,,,,
grateau,0,,,,,,,,,,,,,,,,,,,,,,,,,,
putty,0,a dough-like mixture of whiting and boiled linseed oil; used especially to patch woodwork or secure panes of glass,,,,,,,,,,,,,,,,,,,,,,,,,
drawer,0,a boxlike container in a piece of furniture; made so as to slide in and out,the person who writes a check or draft instructing the drawee to pay someone else,an artist skilled at drawing,,,,,,,,,,,,,,,,,,,,,,,
bolt,0,a discharge of lightning accompanied by thunder,a sliding bar in a breech-loading firearm that ejects an empty cartridge and replaces it and closes the breech,the part of a lock that is engaged or withdrawn with a key,the act of moving with great haste,a roll of cloth or wallpaper of a definite length,a screw that screws into a nut to form a fastener,a sudden abandonment (as from a political party),,,,,,,,,,,,,,,,,,,
barrel,0,a tube through which a bullet travels when a gun is fired,a cylindrical container that holds liquids,a bulging cylindrical shape; hollow with flat ends,the quantity that a barrel (of any size) will hold,any of various units of capacity,,,,,,,,,,,,,,,,,,,,,
gimlet,0,a cocktail made of gin or vodka and lime juice,hand tool for boring holes,,,,,,,,,,,,,,,,,,,,,,,,
top,0,the upper part of anything,the highest or uppermost side of anything,the top or extreme point of something (usually a mountain or hill),the first half of an inning; while the visiting team is at bat,the highest level or degree attainable; the highest stage of development,the greatest possible intensity,platform surrounding the head of a lower mast,a conical child's plaything tapering to a steel point on which it can be made to spin,covering for a hole (especially a hole in the top of a container),a garment (especially for women) that extends from the shoulders to the waist or hips,a canvas tent to house the audience at a circus performance,,,,,,,,,,,,,,,
palm,0,the inner surface of the hand from the wrist to the base of the fingers,a linear unit based on the length or width of the human hand,any plant of the family Palmae having an unbranched trunk crowned by large pinnate or palmate leaves,an award for winning a championship or commemorating some other event,,,,,,,,,,,,,,,,,,,,,,
bucket,0,a roughly cylindrical vessel that is open at the top,the quantity contained in a bucket,,,,,,,,,,,,,,,,,,,,,,,,
pillar,0,a fundamental principle or practice,anything that approximates the shape of a column or tower,a prominent supporter,a vertical cylindrical structure standing alone and not supporting anything (such as a monument),(architecture) a tall vertical cylindrical structure standing upright and used to support a structure,,,,,,,,,,,,,,,,,,,,,
table,0,a set of data arranged in rows and columns,a piece of furniture having a smooth flat top that is usually supported by one or more vertical legs,a piece of furniture with tableware for a meal laid out on it,flat tableland with steep edges,a company of people assembled at a table for a meal or game,food or meals in general,,,,,,,,,,,,,,,,,,,,
auger,0,a long flexible steel coil for dislodging stoppages in curved pipes,hand tool for boring holes,,,,,,,,,,,,,,,,,,,,,,,,
lid,0,either of two folds of skin that can be moved to cover or open the eye,"a movable top or cover (hinged or separate) for closing the opening at the top of a box, chest, jar, pan, etc.",headdress that protects the head from bad weather; has shaped crown and usually a brim,,,,,,,,,,,,,,,,,,,,,,,
almond,0,small bushy deciduous tree native to Asia and North Africa having pretty pink blossoms and highly prized edible nuts enclosed in a hard green hull; cultivated in southern Australia and California,oval-shaped edible seed of the almond tree,,,,,,,,,,,,,,,,,,,,,,,,
wimble,0,hand tool for boring holes,,,,,,,,,,,,,,,,,,,,,,,,,
stick,0,an implement consisting of a length of wood,a small thin branch of a tree,a lever used by a pilot to control the ailerons and elevators of an airplane,a rectangular quarter pound block of butter or margarine,informal terms for the leg,a long implement (usually made of wood) that is shaped so that hockey or polo players can hit a puck or ball,a long thin implement resembling a length of wood,marijuana leaves rolled into a cigarette for smoking,threat of a penalty,,,,,,,,,,,,,,,,,
cage,0,an enclosure made or wire or metal bars in which birds or animals can be kept,something that restricts freedom as a cage restricts movement,United States composer of avant-garde music (1912-1992) (not an entity),the net that is the goal in ice hockey,a movable screen placed behind home base to catch balls during batting practice,,,,,,,,,,,,,,,,,,,,,
sift,0,,,,,,,,,,,,,,,,,,,,,,,,,,
peg,0,a wooden pin pushed or driven into a surface,small markers inserted into a surface to mark scores or define locations etc.,informal terms for the leg,a prosthesis that replaces a missing leg,regulator that can be turned to regulate the pitch of the strings of a stringed instrument,a holder attached to the gunwale of a boat that holds the oar in place and acts as a fulcrum for rowing,,,,,,,,,,,,,,,,,,,,
grate,0,a frame of iron bars to hold a fire,a harsh rasping sound made by scraping something,a barrier that has parallel or crossed bars blocking a passage but admitting air,,,,,,,,,,,,,,,,,,,,,,,
rammer,0,a tool for driving something with force,,,,,,,,,,,,,,,,,,,,,,,,,
retort,0,a quick reply to a question or remark (especially a witty or critical one),a vessel where substances are distilled or decomposed by heat,,,,,,,,,,,,,,,,,,,,,,,,
tongue,0,a mobile mass of muscular tissue covered with mucous membrane and located in the oral cavity,a human written or spoken language used by a community; opposed to e.g. a computer language,any long thin projection that is transient,a manner of speaking,a narrow strip of land that juts out into the sea,the tongue of certain animals used as meat,the flap of material under the laces of a shoe or boot,metal striker that hangs inside a bell and makes a sound by hitting the side,,,,,,,,,,,,,,,,,,
boxwood,0,very hard tough close-grained light yellow wood of the box (particularly the common box); used in delicate woodwork: musical instruments and inlays and engraving blocks,evergreen shrubs or small trees,,,,,,,,,,,,,,,,,,,,,,,,
handle,0,the appendage to an object that is designed to be held in order to use or move it,,,,,,,,,,,,,,,,,,,,,,,,,
tweezer,0,a hand tool for holding consisting of a compound lever for grasping,,,,,,,,,,,,,,,,,,,,,,,,,
cornet,0,a brass musical instrument with a brilliant tone; has a narrow tube and a flared bell and is played by means of valves,,,,,,,,,,,,,,,,,,,,,,,,,
cauldron,0,a very large pot that is used for boiling,,,,,,,,,,,,,,,,,,,,,,,,,
wheel,0,a simple machine consisting of a circular frame with spokes (or a solid disc) that can rotate on a shaft or axle (as in vehicles or other machines),a handwheel that is used for steering,forces that provide energy and direction,a circular helm to control the rudder of a vessel,game equipment consisting of a wheel with slots that is used for gambling; the wheel rotates horizontally and players bet on which slot the roulette ball will stop in,an instrument of torture that stretches or disjoints or mutilates victims,a wheeled vehicle that has two wheels and is moved by foot pedals,,,,,,,,,,,,,,,,,,,
bedpost,0,any of 4 vertical supports at the corners of a bedstead,,,,,,,,,,,,,,,,,,,,,,,,,
fingertip,0,the end (tip) of a finger,,,,,,,,,,,,,,,,,,,,,,,,,
finger,0,any of the terminal members of the hand (sometimes excepting the thumb),the length of breadth of a finger used as a linear measure,one of the parts of a glove that provides covering for a finger or thumb,,,,,,,,,,,,,,,,,,,,,,,
mortar,0,a muzzle-loading high-angle gun with a short barrel that fires shells at high elevations for a short range,used as a bond in masonry or for covering a wall,a bowl-shaped vessel in which substances can be ground and mixed with a pestle,,,,,,,,,,,,,,,,,,,,,,,
jewel,0,a precious or semiprecious stone incorporated into a piece of jewelry,a person who is as brilliant and precious as a piece of jewelry,,,,,,,,,,,,,,,,,,,,,,,,
torch,0,a light usually carried in the hand; consists of some flammable substance,tall-stalked very woolly mullein with densely packed yellow flowers; ancient Greeks and Romans dipped the stalks in tallow for funeral torches,a small portable battery-powered electric lamp,a burner that mixes air and gas to produce a very hot flame,,,,,,,,,,,,,,,,,,,,,,
token,0,an individual instance of a type of symbol,something serving as a sign of something else,a metal or plastic disk that can be redeemed or used in designated slot machines,something of sentimental value,,,,,,,,,,,,,,,,,,,,,,
forge,0,furnace consisting of a special hearth where metal is heated before shaping,a workplace where metal is worked by heating and hammering,,,,,,,,,,,,,,,,,,,,,,,,
chasing,0,,,,,,,,,,,,,,,,,,,,,,,,,,
beater,0,a worker who rouses wild game from under cover for a hunter,an implement for beating,,,,,,,,,,,,,,,,,,,,,,,,
muid,0,,,,,,,,,,,,,,,,,,,,,,,,,,
semal,0,,,,,,,,,,,,,,,,,,,,,,,,,,
compass,0,navigational instrument for finding directions,an area in which something acts or operates or has power or control:,the limit of capability,drafting instrument used for drawing circles,,,,,,,,,,,,,,,,,,,,,,
wedge,0,any shape that is triangular in cross section,a large sandwich made of a long crusty roll split lengthwise and filled with meats and cheese (and tomato and onion and lettuce and condiments); different names are used in different sections of the United States,a diacritical mark (an inverted circumflex) placed above certain letters (such as the letter c) to indicate pronunciation,a heel that is an extension of the sole of the shoe,(golf) an iron with considerable loft and a broad sole,something solid that is usable as an inclined plane (shaped like a V) that can be pushed between two things to separate them,a block of wood used to prevent the sliding or rolling of a heavy object,,,,,,,,,,,,,,,,,,,
eye,0,the organ of sight,good discernment (either visually or as if visually),attention to what is seen,an area that is approximately central within some larger region,a small hole or loop (as in a needle),,,,,,,,,,,,,,,,,,,,,
pincer,0,a hand tool for holding consisting of a compound lever for grasping,a grasping structure on the limb of a crustacean or other arthropods,,,,,,,,,,,,,,,,,,,,,,,,
basin,0,a bowl-shaped vessel; usually used for holding food or liquids,the quantity that a basin will hold,a natural depression in the surface of the land often with a lake at the bottom of it,the entire geographical area drained by a river and its tributaries; an area characterized by all runoff being conveyed to the same outlet,a bathroom sink that is permanently installed and connected to a water supply and drainpipe; where you can wash your hands and face,,,,,,,,,,,,,,,,,,,,,
gouge,0,an impression in a surface (as made by a blow),and edge tool with a blade like a trough for cutting channels or grooves,the act of gouging,,,,,,,,,,,,,,,,,,,,,,,
rope,0,a strong line,street names for flunitrazepan,,,,,,,,,,,,,,,,,,,,,,,,
taper,0,a convex shape that narrows toward a point,the property possessed by a shape that narrows toward a point (as a wedge or cone),a loosely woven cord (in a candle or oil lamp) that draws fuel by capillary action up into the flame,stick of wax with a wick in the middle,,,,,,,,,,,,,,,,,,,,,,
cupel,0,a small porous bowl made of bone ash used in assaying to separate precious metals from e.g. lead,,,,,,,,,,,,,,,,,,,,,,,,,
toothpick,0,pick consisting of a small strip of wood or plastic; used to pick food from between the teeth,,,,,,,,,,,,,,,,,,,,,,,,,
scratch-brushed,0,,,,,,,,,,,,,,,,,,,,,,,,,,
hearth,0,an open recess in a wall at the base of a chimney where a fire can be built,home symbolized as a part of the fireplace,an area near a fireplace (usually paved and extending out into a room),,,,,,,,,,,,,,,,,,,,,,,
rod,0,a long thin implement made of metal or wood,any rod-shaped bacterium,a linear measure of 16.5 feet,a square rod of land,a visual receptor cell that is sensitive to dim light,a gangster's pistol,,,,,,,,,,,,,,,,,,,,
firkin,0,a British unit of capacity equal to 9 imperial gallons,a small wooden keg,,,,,,,,,,,,,,,,,,,,,,,,
baton,0,a thin tapered rod used by a conductor to lead an orchestra or choir,a short stout club used primarily by policemen,a short staff carried by some officials to symbolize an office or an authority,a hollow metal rod that is wielded or twirled by a drum major or drum majorette,a hollow cylinder passed from runner to runner in a relay race,,,,,,,,,,,,,,,,,,,,,
bushel,0,a United States dry measure equal to 4 pecks or 2152.42 cubic inches,a British imperial capacity measure (liquid or dry) equal to 4 pecks,,,,,,,,,,,,,,,,,,,,,,,,
arson,0,malicious burning to destroy property,,,,,,,,,,,,,,,,,,,,,,,,,
bat,0,nocturnal mouselike mammal with forelimbs modified to form membranous wings and anatomical adaptations for echolocation by which they navigate,(baseball) a turn trying to get a hit,a small racket with a long handle used for playing squash,the club used in playing cricket,a club used for hitting a ball in various games,,,,,,,,,,,,,,,,,,,,,
ember,0,a hot fragment of wood or coal that is left from a fire and is glowing or smoldering,,,,,,,,,,,,,,,,,,,,,,,,,
horsetail,0,perennial rushlike flowerless herbs with jointed hollow stems and narrow toothlike leaves that spread by creeping rhizomes; tend to become weedy; common in northern hemisphere; some in Africa and South America,,,,,,,,,,,,,,,,,,,,,,,,,
ladle,0,a spoon-shaped vessel with a long handle; frequently used to transfer liquids from one container to another,,,,,,,,,,,,,,,,,,,,,,,,,
cochiaro,0,,,,,,,,,,,,,,,,,,,,,,,,,,
glove,0,the handwear used by fielders in playing baseball,handwear: covers the hand and wrist,boxing equipment consisting of big and padded coverings for the fists of the fighters; worn for the sport of boxing,,,,,,,,,,,,,,,,,,,,,,,
tooth,0,hard bonelike structures in the jaws of vertebrates; used for biting and chewing or for attack and defense,something resembling the tooth of an animal,toothlike structure in invertebrates found in the mouth or alimentary canal or on a shell,a means of enforcement,one of a number of uniform projections on a gear,,,,,,,,,,,,,,,,,,,,,
file,0,a set of related records (either written or electronic) kept together,a line of persons or things ranged one behind the other,office furniture consisting of a container for keeping papers in order,a steel hand tool with small sharp teeth on some or all of its surfaces; used for smoothing wood or metal,,,,,,,,,,,,,,,,,,,,,,
saw,0,a condensed but memorable saying embodying some important fact of experience that is taken as true by many people,hand tool having a toothed blade for cutting,a power tool for cutting wood,,,,,,,,,,,,,,,,,,,,,,,
clamp,0,a device (generally used by carpenters) that holds things firmly together,,,,,,,,,,,,,,,,,,,,,,,,,
matrix,0,(mathematics) a rectangular array of quantities or expressions set out by rows and columns; treated as a single element and manipulated according to rules,"(geology) amass of fine-grained rock in which fossils, crystals, or gems are embedded",an enclosure within which something originates or develops (from the Latin for womb),the body substance in which tissue cells are embedded,the formative tissue at the base of a nail,"mold used in the production of phonograph records, type, or other relief surface",,,,,,,,,,,,,,,,,,,,
flask,0,bottle that has a narrow neck,the quantity a flask will hold,,,,,,,,,,,,,,,,,,,,,,,,
quadrant,0,a quarter of the circumference of a circle,any of the four areas into which a plane is divided by two orthogonal coordinate axes,the area enclosed by two perpendicular radii of a circle,a measuring instrument for measuring altitude of heavenly bodies,,,,,,,,,,,,,,,,,,,,,,
vessel,0,a tube in which a body fluid circulates,a craft designed for water transportation,an object used as a container (especially for liquids),,,,,,,,,,,,,,,,,,,,,,,
